{
  "$schema": "http://json-schema.org/draft-07/schema#",
  "title": "ILSpy color theme",
  "description": "A color theme. Comments and trailing commas are allowed. The file's name without .json is the theme's id.",
  "type": "object",
  "additionalProperties": false,
  "properties": {
    "$schema": {
      "description": "The schema theme files follow.",
      "type": "string"
    },
    "name": {
      "description": "The name the theme is listed by: one for every language, or one per language tag, such as en or pt-BR, where English stands in for a language without one.",
      "oneOf": [
        {
          "type": "string"
        },
        {
          "type": "object",
          "additionalProperties": {
            "type": "string"
          }
        }
      ]
    },
    "type": {
      "description": "Whether the theme is dark or light. A theme that extends no other takes the code and icon colors of the built-in theme of its type.",
      "enum": [
        "dark",
        "light"
      ]
    },
    "extends": {
      "description": "The id of a built-in or user theme to build on; what this theme leaves out comes from it.",
      "type": "string"
    },
    "palette": {
      "description": "Named colors the ui, code and icons sections can use by name. A theme's palette is merged over those of the themes it extends.",
      "type": "object",
      "additionalProperties": {
        "$ref": "#/definitions/hexColor"
      }
    },
    "ui": {
      "description": "The interface's colors. Required unless an extended theme sets them: background, surface, control, field, border, text, textMuted, accent, onAccent. The others are derived from these when left out.",
      "type": "object",
      "additionalProperties": false,
      "properties": {
        "background": {
          "description": "The workspace: the window, trees and lists.",
          "$ref": "#/definitions/color"
        },
        "surface": {
          "description": "Docked chrome: menu bar, main toolbar, tab strip, status bar. A pane's own body and toolbar use paneBackground.",
          "$ref": "#/definitions/color"
        },
        "surfaceRaised": {
          "description": "Floating surfaces: menus, tooltips, dialogs.",
          "$ref": "#/definitions/color"
        },
        "control": {
          "description": "The base of neutral buttons and segments.",
          "$ref": "#/definitions/color"
        },
        "controlHovered": {
          "description": "Derived from other colors, or a default, when unset.",
          "$ref": "#/definitions/color"
        },
        "controlPressed": {
          "description": "Derived from other colors, or a default, when unset.",
          "$ref": "#/definitions/color"
        },
        "field": {
          "description": "Editable fields.",
          "$ref": "#/definitions/color"
        },
        "editorBackground": {
          "description": "A document or code view's background.",
          "$ref": "#/definitions/color"
        },
        "paneBackground": {
          "description": "A docked pane's body, which its selected tab, toolbar and table header share so the tab reads as attached to what is below it.",
          "$ref": "#/definitions/color"
        },
        "paneToolbarBackground": {
          "description": "A toolbar along the top of a pane.",
          "$ref": "#/definitions/color"
        },
        "tableHeaderBackground": {
          "description": "The column headings of a table.",
          "$ref": "#/definitions/color"
        },
        "tabStripBackground": {
          "description": "The strip behind a pane's tabs.",
          "$ref": "#/definitions/color"
        },
        "tabActiveBackground": {
          "description": "The selected tab, joined to its pane.",
          "$ref": "#/definitions/color"
        },
        "tabHoverBackground": {
          "description": "An unselected tab under the pointer.",
          "$ref": "#/definitions/color"
        },
        "border": {
          "description": "Component outlines.",
          "$ref": "#/definitions/color"
        },
        "borderStrong": {
          "description": "An outline that answers the pointer: a hovered field, a hovered splitter.",
          "$ref": "#/definitions/color"
        },
        "separator": {
          "description": "Structural divisions between panes and groups.",
          "$ref": "#/definitions/color"
        },
        "text": {
          "$ref": "#/definitions/color"
        },
        "textMuted": {
          "description": "Secondary text: metadata, placeholders, shortcuts.",
          "$ref": "#/definitions/color"
        },
        "textDisabled": {
          "description": "Text of a control that cannot be used.",
          "$ref": "#/definitions/color"
        },
        "accent": {
          "description": "Primary filled actions and checked state.",
          "$ref": "#/definitions/color"
        },
        "accentHovered": {
          "description": "Derived from other colors, or a default, when unset.",
          "$ref": "#/definitions/color"
        },
        "accentPressed": {
          "description": "Derived from other colors, or a default, when unset.",
          "$ref": "#/definitions/color"
        },
        "onAccent": {
          "description": "Text drawn on accent.",
          "$ref": "#/definitions/color"
        },
        "accentText": {
          "description": "Links and activity text, readable on background.",
          "$ref": "#/definitions/color"
        },
        "focusRing": {
          "description": "The ring a widget holding keyboard focus draws.",
          "$ref": "#/definitions/color"
        },
        "rowHover": {
          "description": "An unselected row under the pointer.",
          "$ref": "#/definitions/color"
        },
        "selection": {
          "description": "Selected rows, segments and highlighted menu items in the focused pane.",
          "$ref": "#/definitions/color"
        },
        "selectionInactive": {
          "description": "A selection whose pane does not hold focus.",
          "$ref": "#/definitions/color"
        },
        "selectionText": {
          "description": "Text on selection and selectionInactive.",
          "$ref": "#/definitions/color"
        },
        "textSelection": {
          "description": "Selected text, distinct from selection so it shows on a selected row.",
          "$ref": "#/definitions/color"
        },
        "danger": {
          "description": "Derived from other colors, or a default, when unset.",
          "$ref": "#/definitions/color"
        },
        "dangerSurface": {
          "description": "Derived from other colors, or a default, when unset.",
          "$ref": "#/definitions/color"
        },
        "onDanger": {
          "description": "Text on a solid danger badge.",
          "$ref": "#/definitions/color"
        },
        "warning": {
          "description": "Derived from other colors, or a default, when unset.",
          "$ref": "#/definitions/color"
        },
        "warningSurface": {
          "description": "Derived from other colors, or a default, when unset.",
          "$ref": "#/definitions/color"
        },
        "success": {
          "description": "Derived from other colors, or a default, when unset.",
          "$ref": "#/definitions/color"
        },
        "scrim": {
          "description": "The backdrop dimming what is behind a modal dialog.",
          "$ref": "#/definitions/color"
        },
        "scrollThumb": {
          "description": "Derived from other colors, or a default, when unset.",
          "$ref": "#/definitions/color"
        },
        "scrollThumbHovered": {
          "description": "Derived from other colors, or a default, when unset.",
          "$ref": "#/definitions/color"
        },
        "scrollThumbHeld": {
          "description": "Derived from other colors, or a default, when unset.",
          "$ref": "#/definitions/color"
        },
        "popupShadowColor": {
          "description": "The shadow under menus, context menus and tooltips.",
          "$ref": "#/definitions/color"
        },
        "dialogShadowColor": {
          "description": "The shadow under a modal dialog's card.",
          "$ref": "#/definitions/color"
        }
      }
    },
    "code": {
      "description": "The code view's colors. Those left out come from the theme extended, else from the built-in theme of the type.",
      "type": "object",
      "additionalProperties": false,
      "properties": {
        "plain": {
          "$ref": "#/definitions/color"
        },
        "keyword": {
          "$ref": "#/definitions/color"
        },
        "type": {
          "$ref": "#/definitions/color"
        },
        "namespace": {
          "$ref": "#/definitions/color"
        },
        "method": {
          "$ref": "#/definitions/color"
        },
        "member": {
          "$ref": "#/definitions/color"
        },
        "parameter": {
          "$ref": "#/definitions/color"
        },
        "string": {
          "$ref": "#/definitions/color"
        },
        "number": {
          "$ref": "#/definitions/color"
        },
        "comment": {
          "$ref": "#/definitions/color"
        },
        "preprocessor": {
          "$ref": "#/definitions/color"
        },
        "ilOpcode": {
          "$ref": "#/definitions/color"
        },
        "ilLabel": {
          "$ref": "#/definitions/color"
        },
        "gutterText": {
          "$ref": "#/definitions/color"
        },
        "gutterSeparator": {
          "$ref": "#/definitions/color"
        },
        "foldChip": {
          "$ref": "#/definitions/color"
        },
        "foldChipHovered": {
          "$ref": "#/definitions/color"
        },
        "occurrence": {
          "$ref": "#/definitions/color"
        },
        "findMatch": {
          "$ref": "#/definitions/color"
        },
        "currentFind": {
          "$ref": "#/definitions/color"
        },
        "currentFindOutline": {
          "$ref": "#/definitions/color"
        },
        "flash": {
          "$ref": "#/definitions/color"
        },
        "currentLine": {
          "description": "The background of the caret's line, when it is highlighted.",
          "$ref": "#/definitions/color"
        },
        "matchingBracket": {
          "description": "The background of the bracket at the caret and the one matching it.",
          "$ref": "#/definitions/color"
        },
        "bookmark": {
          "description": "The gutter mark of an enabled bookmark.",
          "$ref": "#/definitions/color"
        }
      }
    },
    "icons": {
      "description": "The tree's icon colors. Those left out come from the theme extended, else from the built-in theme of the type.",
      "type": "object",
      "additionalProperties": false,
      "properties": {
        "neutral": {
          "$ref": "#/definitions/color"
        },
        "type": {
          "$ref": "#/definitions/color"
        },
        "method": {
          "$ref": "#/definitions/color"
        },
        "data": {
          "$ref": "#/definitions/color"
        },
        "error": {
          "$ref": "#/definitions/color"
        },
        "restricted": {
          "description": "The color of the accessibility overlay on non-public nodes' icons.",
          "$ref": "#/definitions/color"
        }
      }
    }
  },
  "definitions": {
    "hexColor": {
      "description": "#RRGGBB, or #RRGGBBAA with alpha. #00000000 reads as unset, so it is refused; for an invisible color write another transparent one, such as #FFFFFF00.",
      "type": "string",
      "pattern": "^#([0-9A-Fa-f]{6}|[0-9A-Fa-f]{8})$",
      "not": {
        "const": "#00000000"
      }
    },
    "color": {
      "anyOf": [
        {
          "$ref": "#/definitions/hexColor"
        },
        {
          "description": "The name of a palette color.",
          "type": "string",
          "pattern": "^[^#]"
        }
      ]
    }
  }
}
