{
  "$schema": "./theme.schema.json",
  "name": "Catppuccin Mocha",
  "type": "dark",
  "ui": {
    "background": "#181825",
    "surface": "#11111B",
    "surfaceRaised": "#1E1E2E",
    "control": "#313244",
    "field": "#1E1E2E",
    "border": "#45475A",
    "separator": "#313244",
    "text": "#CDD6F4",
    "textMuted": "#A6ADC8",
    "textDisabled": "#6C7086",
    "accent": "#CBA6F7",
    "onAccent": "#11111B",
    "accentText": "#CBA6F7",
    "focusRing": "#CBA6F7",
    "rowHover": "#242536",
    "selection": "#45475A",
    "selectionInactive": "#313244",
    "textSelection": "#686083",
    "danger": "#F38BA8",
    "warning": "#F9E2AF",
    "success": "#A6E3A1",
    "scrim": "#00000099"
  },
  "code": {
    "plain": "#CDD6F4",
    "keyword": "#CBA6F7",
    "type": "#F9E2AF",
    "namespace": "#CDD6F4",
    "method": "#89B4FA",
    "member": "#B4BEFE",
    "parameter": "#EBA0AC",
    "string": "#A6E3A1",
    "number": "#FAB387",
    "comment": "#9399B2",
    "preprocessor": "#F5C2E7",
    "ilOpcode": "#CBA6F7",
    "ilLabel": "#94E2D5",
    "gutterText": "#7F849C",
    "gutterSeparator": "#313244",
    "foldChip": "#313244",
    "foldChipHovered": "#45475A",
    "occurrence": "#2E3047",
    "findMatch": "#4B3B40",
    "currentFind": "#765A51",
    "currentFindOutline": "#FAB387",
    "flash": "#2F3A5A",
    "currentLine": "#262637",
    "matchingBracket": "#45475A",
    "bookmark": "#89B4FA"
  },
  "icons": {
    "neutral": "#A6ADC8",
    "type": "#F9E2AF",
    "method": "#89B4FA",
    "data": "#B4BEFE",
    "error": "#F38BA8",
    "restricted": "#FAB387"
  }
}
