{
  "$schema": "./theme.schema.json",
  "name": "GitHub Light",
  "type": "light",
  "ui": {
    "background": "#FFFFFF",
    "surface": "#F6F8FA",
    "surfaceRaised": "#FFFFFF",
    "control": "#F6F8FA",
    "controlHovered": "#EEF1F4",
    "controlPressed": "#E6EAEF",
    "field": "#FFFFFF",
    "border": "#D0D7DE",
    "separator": "#D8DEE4",
    "text": "#1F2328",
    "textMuted": "#59636E",
    "textDisabled": "#818B98",
    "accent": "#0969DA",
    "onAccent": "#FFFFFF",
    "accentText": "#0969DA",
    "focusRing": "#0969DA",
    "rowHover": "#F2F4F6",
    "selection": "#DDF4FF",
    "selectionInactive": "#EAEEF2",
    "textSelection": "#3E8CE3",
    "selectionText": "#1F2328",
    "danger": "#CF222E",
    "dangerSurface": "#FFEBE9",
    "onDanger": "#FFFFFF",
    "warning": "#9A6700",
    "warningSurface": "#FFF8C5",
    "success": "#1A7F37",
    "scrim": "#00000059",
    "scrollThumb": "#8C959F",
    "scrollThumbHovered": "#6E7781",
    "scrollThumbHeld": "#57606A",
    "popupShadowColor": "#00000024",
    "dialogShadowColor": "#00000033"
  },
  "code": {
    "plain": "#1F2328",
    "keyword": "#CF222E",
    "type": "#953800",
    "namespace": "#1F2328",
    "method": "#8250DF",
    "member": "#0550AE",
    "parameter": "#1F2328",
    "string": "#0A3069",
    "number": "#0550AE",
    "comment": "#6E7781",
    "preprocessor": "#CF222E",
    "ilOpcode": "#CF222E",
    "ilLabel": "#116329",
    "gutterText": "#6E7781",
    "gutterSeparator": "#EAEEF2",
    "foldChip": "#EFF2F5",
    "foldChipHovered": "#E4E8EC",
    "occurrence": "#E6EEF9",
    "findMatch": "#FFF8C5",
    "currentFind": "#FAE17D",
    "currentFindOutline": "#9A6700",
    "flash": "#DDF4FF",
    "currentLine": "#F6F8FA",
    "matchingBracket": "#D4E3F7",
    "bookmark": "#0969DA"
  },
  "icons": {
    "neutral": "#59636E",
    "type": "#953800",
    "method": "#8250DF",
    "data": "#0550AE",
    "error": "#CF222E",
    "restricted": "#9A6700"
  }
}
