{
  "$schema": "./theme.schema.json",
  "name": "GitHub Dark",
  "type": "dark",
  "ui": {
    "background": "#0D1117",
    "surface": "#010409",
    "surfaceRaised": "#161B22",
    "control": "#21262D",
    "field": "#0D1117",
    "border": "#30363D",
    "separator": "#21262D",
    "text": "#E6EDF3",
    "textMuted": "#8B949E",
    "textDisabled": "#6E7681",
    "accent": "#1F6FEB",
    "onAccent": "#FFFFFF",
    "accentText": "#4493F8",
    "focusRing": "#1F6FEB",
    "rowHover": "#161B22",
    "selection": "#1F3049",
    "selectionInactive": "#21262D",
    "textSelection": "#1D66D6",
    "danger": "#F85149",
    "warning": "#D29922",
    "success": "#3FB950",
    "scrim": "#00000099"
  },
  "code": {
    "plain": "#E6EDF3",
    "keyword": "#FF7B72",
    "type": "#FFA657",
    "namespace": "#E6EDF3",
    "method": "#D2A8FF",
    "member": "#79C0FF",
    "parameter": "#E6EDF3",
    "string": "#A5D6FF",
    "number": "#79C0FF",
    "comment": "#8B949E",
    "preprocessor": "#FF7B72",
    "ilOpcode": "#FF7B72",
    "ilLabel": "#7EE787",
    "gutterText": "#6E7681",
    "gutterSeparator": "#21262D",
    "foldChip": "#21262D",
    "foldChipHovered": "#30363D",
    "occurrence": "#253040",
    "findMatch": "#4A3E1E",
    "currentFind": "#6B5418",
    "currentFindOutline": "#D29922",
    "flash": "#1F3A63",
    "currentLine": "#161B22",
    "matchingBracket": "#2D3A4D",
    "bookmark": "#58A6FF"
  },
  "icons": {
    "neutral": "#8B949E",
    "type": "#FFA657",
    "method": "#D2A8FF",
    "data": "#79C0FF",
    "error": "#F85149",
    "restricted": "#D29922"
  }
}
