{
  "$schema": "./theme.schema.json",
  "name": "Dracula",
  "type": "dark",
  "ui": {
    "background": "#21222C",
    "surface": "#191A21",
    "surfaceRaised": "#343746",
    "control": "#44475A",
    "field": "#282A36",
    "border": "#4D5066",
    "separator": "#191A21",
    "text": "#F8F8F2",
    "textMuted": "#9CA3C4",
    "textDisabled": "#6272A4",
    "accent": "#BD93F9",
    "onAccent": "#282A36",
    "accentText": "#BD93F9",
    "focusRing": "#BD93F9",
    "rowHover": "#2C2E3B",
    "selection": "#44475A",
    "selectionInactive": "#363848",
    "textSelection": "#7A69A2",
    "danger": "#FF5555",
    "warning": "#FFB86C",
    "success": "#50FA7B",
    "scrim": "#00000099"
  },
  "code": {
    "plain": "#F8F8F2",
    "keyword": "#FF79C6",
    "type": "#8BE9FD",
    "namespace": "#F8F8F2",
    "method": "#50FA7B",
    "member": "#F8F8F2",
    "parameter": "#FFB86C",
    "string": "#F1FA8C",
    "number": "#BD93F9",
    "comment": "#6272A4",
    "preprocessor": "#FF79C6",
    "ilOpcode": "#FF79C6",
    "ilLabel": "#BD93F9",
    "gutterText": "#6272A4",
    "gutterSeparator": "#343746",
    "foldChip": "#343746",
    "foldChipHovered": "#44475A",
    "occurrence": "#3C3F52",
    "findMatch": "#524335",
    "currentFind": "#6E523A",
    "currentFindOutline": "#FFB86C",
    "flash": "#44475A",
    "currentLine": "#31333F",
    "matchingBracket": "#4B4E63",
    "bookmark": "#BD93F9"
  },
  "icons": {
    "neutral": "#9CA3C4",
    "type": "#8BE9FD",
    "method": "#50FA7B",
    "data": "#FFB86C",
    "error": "#FF5555",
    "restricted": "#F1FA8C"
  }
}
