{
  "$schema": "./theme.schema.json",
  "name": { "en": "Dark", "de": "Dunkel", "es": "Oscuro", "fr": "Sombre", "ja": "ダーク", "ko": "어둡게", "pt-BR": "Escuro", "ru": "Тёмная", "zh-Hans": "深色" },
  "type": "dark",
  "ui": {
    "background": "#1B1E24",
    "surface": "#22252C",
    "surfaceRaised": "#2A2F38",
    "control": "#303641",
    "controlHovered": "#3A414D",
    "controlPressed": "#424B59",
    "field": "#191C22",
    "editorBackground": "#191C22",
    "border": "#4B5362",
    "borderStrong": "#8B95A5",
    "separator": "#343A45",
    "text": "#E4E7ED",
    "textMuted": "#A6ACB8",
    "textDisabled": "#747D8C",
    "accent": "#356FE0",
    "accentHovered": "#4079E8",
    "accentPressed": "#2D62C9",
    "onAccent": "#FFFFFF",
    "accentText": "#8AB4FF",
    "focusRing": "#7AA7FF",
    "rowHover": "#2B303A",
    "selection": "#293D60",
    "selectionInactive": "#303641",
    "textSelection": "#3264C4",
    "selectionText": "#E4E7ED",
    "danger": "#FF9A9A",
    "dangerSurface": "#472A32",
    "onDanger": "#29171B",
    "warning": "#E6BE73",
    "warningSurface": "#443821",
    "success": "#8BC99C",
    "scrim": "#00000099",
    "scrollThumb": "#626D80",
    "scrollThumbHovered": "#7B879B",
    "scrollThumbHeld": "#95A4BD",
    "popupShadowColor": "#00000066",
    "dialogShadowColor": "#00000080"
  },
  "code": {
    "plain": "#D8DEE9",
    "keyword": "#8FB8FF",
    "type": "#88CEC3",
    "namespace": "#D8DEE9",
    "method": "#D7C58F",
    "member": "#D8DEE9",
    "parameter": "#B4C9E8",
    "string": "#DDB293",
    "number": "#BACD9B",
    "comment": "#879E84",
    "preprocessor": "#A6ACB8",
    "ilOpcode": "#8FB8FF",
    "ilLabel": "#C3AADF",
    "gutterText": "#919BAA",
    "gutterSeparator": "#2D333D",
    "foldChip": "#2A303A",
    "foldChipHovered": "#363D49",
    "occurrence": "#29354A",
    "findMatch": "#493C25",
    "currentFind": "#5C4824",
    "currentFindOutline": "#E6BE73",
    "flash": "#2E4470",
    "currentLine": "#20242C",
    "matchingBracket": "#34405A",
    "bookmark": "#6CA6F0"
  },
  "icons": {
    "neutral": "#A6ACB8",
    "type": "#88CEC3",
    "method": "#D7C58F",
    "data": "#B4C9E8",
    "error": "#FF9A9A",
    "restricted": "#E3A57A"
  }
}
