{
  "$schema": "./theme.schema.json",
  "name": "Solarized Light",
  "type": "light",
  "ui": {
    "background": "#FDF6E3",
    "surface": "#EEE8D5",
    "surfaceRaised": "#FDF6E3",
    "control": "#E6DFC9",
    "field": "#FDF6E3",
    "border": "#CCC4AB",
    "separator": "#E3DCC6",
    "text": "#073642",
    "textMuted": "#4E6269",
    "textDisabled": "#93A1A1",
    "accent": "#1F6FA8",
    "onAccent": "#FFFFFF",
    "accentText": "#1F6FA8",
    "focusRing": "#268BD2",
    "rowHover": "#F4EDD9",
    "selection": "#D7E2E0",
    "selectionInactive": "#E9E2CC",
    "textSelection": "#6D9EBD",
    "selectionText": "#073642",
    "danger": "#DC322F",
    "onDanger": "#FFFFFF",
    "warning": "#8A6800",
    "success": "#5E6D00",
    "scrim": "#00000059",
    "scrollThumb": "#93A1A1",
    "scrollThumbHovered": "#839496",
    "scrollThumbHeld": "#657B83",
    "popupShadowColor": "#00000024",
    "dialogShadowColor": "#00000033"
  },
  "code": {
    "plain": "#586E75",
    "keyword": "#859900",
    "type": "#B58900",
    "namespace": "#586E75",
    "method": "#268BD2",
    "member": "#6C71C4",
    "parameter": "#657B83",
    "string": "#2AA198",
    "number": "#D33682",
    "comment": "#93A1A1",
    "preprocessor": "#CB4B16",
    "ilOpcode": "#859900",
    "ilLabel": "#6C71C4",
    "gutterText": "#839496",
    "gutterSeparator": "#EEE8D5",
    "foldChip": "#EEE8D5",
    "foldChipHovered": "#E4DDC8",
    "occurrence": "#E9E3CF",
    "findMatch": "#EBDBAA",
    "currentFind": "#DCC57D",
    "currentFindOutline": "#B58900",
    "flash": "#D2E1E1",
    "currentLine": "#F5EEDA",
    "matchingBracket": "#DDD6C1",
    "bookmark": "#268BD2"
  },
  "icons": {
    "neutral": "#586E75",
    "type": "#B58900",
    "method": "#268BD2",
    "data": "#6C71C4",
    "error": "#DC322F",
    "restricted": "#CB4B16"
  }
}
