{
  "$schema": "./theme.schema.json",
  "name": "Monokai",
  "type": "dark",
  "ui": {
    "background": "#1E1F1C",
    "surface": "#1E1F1C",
    "surfaceRaised": "#2D2E27",
    "control": "#414339",
    "field": "#272822",
    "border": "#575950",
    "separator": "#34352F",
    "text": "#F8F8F2",
    "textMuted": "#A59F85",
    "accent": "#75715E",
    "onAccent": "#F8F8F2",
    "accentText": "#66D9EF",
    "focusRing": "#99947C",
    "rowHover": "#31322B",
    "selection": "#49483E",
    "selectionInactive": "#3A3B33",
    "textSelection": "#736F5C",
    "danger": "#F92672",
    "warning": "#FD971F",
    "success": "#A6E22E",
    "scrim": "#00000099"
  },
  "code": {
    "plain": "#F8F8F2",
    "keyword": "#F92672",
    "type": "#66D9EF",
    "namespace": "#F8F8F2",
    "method": "#A6E22E",
    "member": "#F8F8F2",
    "parameter": "#FD971F",
    "string": "#E6DB74",
    "number": "#AE81FF",
    "comment": "#88846F",
    "preprocessor": "#F92672",
    "ilOpcode": "#F92672",
    "ilLabel": "#AE81FF",
    "gutterText": "#90908A",
    "gutterSeparator": "#3B3C35",
    "foldChip": "#3B3C35",
    "foldChipHovered": "#49483E",
    "occurrence": "#3E3D32",
    "findMatch": "#52502E",
    "currentFind": "#6E6A33",
    "currentFindOutline": "#E6DB74",
    "flash": "#49483E",
    "currentLine": "#31322B",
    "matchingBracket": "#4A4A40",
    "bookmark": "#66D9EF"
  },
  "icons": {
    "neutral": "#A59F85",
    "type": "#66D9EF",
    "method": "#A6E22E",
    "data": "#FD971F",
    "error": "#F92672",
    "restricted": "#E6DB74"
  }
}
