{
  "$schema": "./theme.schema.json",
  "name": "One Dark Pro",
  "type": "dark",
  "ui": {
    "background": "#21252B",
    "surface": "#21252B",
    "surfaceRaised": "#2C313A",
    "control": "#3A3F4B",
    "field": "#1D1F23",
    "editorBackground": "#282C34",
    "border": "#3E4452",
    "separator": "#181A1F",
    "text": "#ABB2BF",
    "textMuted": "#8B909A",
    "accent": "#4570C4",
    "onAccent": "#FFFFFF",
    "accentText": "#61AFEF",
    "focusRing": "#528BFF",
    "rowHover": "#2C313A",
    "selection": "#3E4451",
    "selectionInactive": "#323842",
    "textSelection": "#354E7F",
    "selectionText": "#D7DAE0",
    "danger": "#E06C75",
    "warning": "#E5C07B",
    "success": "#98C379",
    "scrim": "#00000099"
  },
  "code": {
    "plain": "#ABB2BF",
    "keyword": "#C678DD",
    "type": "#E5C07B",
    "namespace": "#ABB2BF",
    "method": "#61AFEF",
    "member": "#E06C75",
    "parameter": "#ABB2BF",
    "string": "#98C379",
    "number": "#D19A66",
    "comment": "#7F848E",
    "preprocessor": "#C678DD",
    "ilOpcode": "#C678DD",
    "ilLabel": "#56B6C2",
    "gutterText": "#636D83",
    "gutterSeparator": "#2C313A",
    "foldChip": "#2C313A",
    "foldChipHovered": "#3A3F4B",
    "occurrence": "#3A404B",
    "findMatch": "#33405A",
    "currentFind": "#42557B",
    "currentFindOutline": "#528BFF",
    "flash": "#2F3E5C",
    "currentLine": "#2C313C",
    "matchingBracket": "#454C5A",
    "bookmark": "#61AFEF"
  },
  "icons": {
    "neutral": "#8B909A",
    "type": "#E5C07B",
    "method": "#61AFEF",
    "data": "#E06C75",
    "error": "#F44747",
    "restricted": "#D19A66"
  }
}
