{
  "$schema": "./theme.schema.json",
  "name": { "en": "Light", "de": "Hell", "es": "Claro", "fr": "Clair", "ja": "ライト", "ko": "밝게", "pt-BR": "Claro", "ru": "Светлая", "zh-Hans": "浅色" },
  "type": "light",
  "ui": {
    "background": "#F7F8FA",
    "surface": "#F0F2F5",
    "surfaceRaised": "#FFFFFF",
    "control": "#E7EBF1",
    "controlHovered": "#DDE3EB",
    "controlPressed": "#CFD7E3",
    "field": "#FFFFFF",
    "editorBackground": "#FFFFFF",
    "border": "#BBC3CF",
    "borderStrong": "#7D8796",
    "separator": "#D9DFE7",
    "text": "#242A35",
    "textMuted": "#5D6675",
    "textDisabled": "#9098A4",
    "accent": "#245FCC",
    "accentHovered": "#2B6BE0",
    "accentPressed": "#1E51B0",
    "onAccent": "#FFFFFF",
    "accentText": "#245FCC",
    "focusRing": "#245FCC",
    "rowHover": "#E8ECF2",
    "selection": "#DCE8FF",
    "selectionInactive": "#E5E8ED",
    "textSelection": "#6890DB",
    "selectionText": "#242A35",
    "danger": "#B42332",
    "dangerSurface": "#FDE7EB",
    "onDanger": "#FFFFFF",
    "warning": "#805500",
    "warningSurface": "#FFF0CC",
    "success": "#286B3D",
    "scrim": "#00000059",
    "scrollThumb": "#8793A6",
    "scrollThumbHovered": "#69768B",
    "scrollThumbHeld": "#506078",
    "popupShadowColor": "#00000024",
    "dialogShadowColor": "#00000033"
  },
  "code": {
    "plain": "#293241",
    "keyword": "#285CC4",
    "type": "#146E68",
    "namespace": "#293241",
    "method": "#79551D",
    "member": "#293241",
    "parameter": "#365A88",
    "string": "#974322",
    "number": "#526D27",
    "comment": "#58704E",
    "preprocessor": "#626A78",
    "ilOpcode": "#285CC4",
    "ilLabel": "#74449A",
    "gutterText": "#687487",
    "gutterSeparator": "#E3E7ED",
    "foldChip": "#ECEFF4",
    "foldChipHovered": "#DFE4EB",
    "occurrence": "#E5EDFA",
    "findMatch": "#FFF0BF",
    "currentFind": "#FFE09A",
    "currentFindOutline": "#805500",
    "flash": "#CFE0FF",
    "currentLine": "#F4F6F9",
    "matchingBracket": "#D6E2F5",
    "bookmark": "#2F6FCF"
  },
  "icons": {
    "neutral": "#5D6675",
    "type": "#146E68",
    "method": "#79551D",
    "data": "#365A88",
    "error": "#B42332",
    "restricted": "#9A4F1C"
  }
}
